{"$schema":"https://json-schema.org/draft/2020-12/schema","$id":"https://onetimeonetime.com/schemas/OPS-08-20260716-9014f99c/OPS-08-INVENTORY.schema.json","title":"OPS-08 Domain, Email, and Legacy Cutover Inventory","type":"object","additionalProperties":false,"required":["task_id","packet_id","captured_at","state","source","domains","railway_services","routes","traffic_migration","email","callbacks","monitoring","rollback","mutation_audit"],"properties":{"task_id":{"const":"OPS-08"},"packet_id":{"const":"OPS-08-20260716-9014f99c"},"captured_at":{"type":"string","format":"date-time"},"state":{"enum":["audit_in_progress","blocked_source_convergence_required","blocked_isolated_staging_required","blocked_migration_threshold","blocked_email_readiness","blocked_callback_readiness","blocked_packet_integrity","blocked_unapproved_root_drift","blocked_provider_guidance_changed","ready_for_dns_operator_action","authorized_window_pending","cutover_in_progress","cutover_observing","rolled_back","cutover_complete"]},"source":{"type":"object","additionalProperties":false,"required":["repository","selected_ref","selected_sha","selection_reason","ancestry_proof","working_tree_clean","version_contract","release_authorized"],"properties":{"repository":{"const":"webcraft-media/onetimev2"},"selected_ref":{"type":["string","null"],"minLength":1},"selected_sha":{"type":["string","null"],"pattern":"^[0-9a-f]{40}$"},"selection_reason":{"type":"string","minLength":20},"ancestry_proof":{"type":"array","minItems":1,"items":{"type":"object","additionalProperties":false,"required":["required_sha","is_ancestor","command_digest"],"properties":{"required_sha":{"type":"string","pattern":"^[0-9a-f]{40}$"},"is_ancestor":{"type":"boolean"},"command_digest":{"type":"string","pattern":"^[0-9a-f]{64}$"}}}},"working_tree_clean":{"type":"boolean"},"version_contract":{"type":"object","additionalProperties":false,"required":["expected_sha","observed_sha","match","app_version","target_app"],"properties":{"expected_sha":{"type":["string","null"],"pattern":"^[0-9a-f]{40}$"},"observed_sha":{"type":["string","null"],"pattern":"^[0-9a-f]{40}$"},"match":{"type":"boolean"},"app_version":{"type":["string","null"]},"target_app":{"type":["string","null"]}}},"release_authorized":{"type":"boolean"}}},"domains":{"type":"array","minItems":3,"items":{"type":"object","additionalProperties":false,"required":["hostname","role","evidence_state","http_status","canonical_behavior","tls","dns_records","root_mutation_permitted"],"properties":{"hostname":{"type":"string","format":"hostname"},"role":{"enum":["root","launch","www","staging","railway_generated","callback_only","legacy"]},"evidence_state":{"enum":["observed","partially_observed","not_observed","not_applicable"]},"http_status":{"type":["integer","null"],"minimum":100,"maximum":599},"canonical_behavior":{"enum":["serves_primary","redirects_to_primary","serves_staging_noindex","callback_only_no_redirect","unknown"]},"tls":{"type":"object","additionalProperties":false,"required":["state","san_match","chain_valid","not_after","issuer"],"properties":{"state":{"enum":["valid","invalid","pending","not_observed"]},"san_match":{"type":["boolean","null"]},"chain_valid":{"type":["boolean","null"]},"not_after":{"type":["string","null"],"format":"date-time"},"issuer":{"type":["string","null"]}}},"dns_records":{"type":"array","items":{"type":"object","additionalProperties":false,"required":["owner","type","ttl","value_sha256","resolver_count","resolver_agreement","captured_at","private_change_set_member"],"properties":{"owner":{"type":"string","format":"hostname"},"type":{"enum":["A","AAAA","CNAME","MX","TXT","NS","CAA","ALIAS","ANAME","OTHER"]},"ttl":{"type":"integer","minimum":0},"value_sha256":{"type":"string","pattern":"^[0-9a-f]{64}$"},"resolver_count":{"type":"integer","minimum":1},"resolver_agreement":{"type":"boolean"},"captured_at":{"type":"string","format":"date-time"},"private_change_set_member":{"type":"boolean"}}}},"root_mutation_permitted":{"type":"boolean"}}}},"railway_services":{"type":"array","minItems":1,"items":{"type":"object","additionalProperties":false,"required":["service_key","environment_class","project_id_sha256","environment_id_sha256","service_id_sha256","deployment_id_sha256","source_sha","public_domain","custom_domains","target_port","health_path","healthcheck_host_validation","healthcheck_host_path_only","healthcheck_request_host","ready_path","version_path","health_state","source_match"],"properties":{"service_key":{"type":"string","minLength":1},"environment_class":{"enum":["isolated_staging","production","unknown"]},"project_id_sha256":{"type":["string","null"],"pattern":"^[0-9a-f]{64}$"},"environment_id_sha256":{"type":["string","null"],"pattern":"^[0-9a-f]{64}$"},"service_id_sha256":{"type":["string","null"],"pattern":"^[0-9a-f]{64}$"},"deployment_id_sha256":{"type":["string","null"],"pattern":"^[0-9a-f]{64}$"},"source_sha":{"type":["string","null"],"pattern":"^[0-9a-f]{40}$"},"public_domain":{"type":["string","null"],"format":"hostname"},"custom_domains":{"type":"array","items":{"type":"string","format":"hostname"}},"target_port":{"type":["integer","null"],"minimum":1,"maximum":65535},"health_path":{"const":"/health"},"ready_path":{"const":"/ready"},"version_path":{"const":"/version"},"health_state":{"enum":["healthy","unhealthy","not_observed"]},"source_match":{"type":"boolean"},"healthcheck_request_host":{"const":"healthcheck.railway.app"},"healthcheck_host_path_only":{"type":"boolean"},"healthcheck_host_validation":{"enum":["pass","fail","not_run","not_applicable"]}}}},"routes":{"type":"array","minItems":1,"items":{"type":"object","additionalProperties":false,"required":["route_id","method","path","class","expected_status","redirect_policy","cache_policy","probe_result"],"properties":{"route_id":{"type":"string","pattern":"^OPS-08-[A-Z0-9_-]+$"},"method":{"enum":["GET","HEAD","POST","OPTIONS"]},"path":{"type":"string","pattern":"^/"},"class":{"enum":["public","authenticated","health","webhook","oauth_callback","legacy_redirect","internal_signed"]},"expected_status":{"type":"array","minItems":1,"items":{"type":"integer","minimum":100,"maximum":599}},"redirect_policy":{"enum":["forbidden","same_path_to_canonical","fixed_legacy_target","none"]},"cache_policy":{"enum":["public","private_no_store","no_store","provider_defined"]},"probe_result":{"enum":["pass","fail","not_run","not_applicable"]}}}},"traffic_migration":{"type":"object","additionalProperties":false,"required":["eligibility_definition_version","eligibility_window_days","measurement_window_start","measurement_window_end","measured_continuous_days","eligible_accounts","migrated_accounts","unresolved_identity_conflicts","successful_old_app_accounts_14d","new_app_login_attempts_14d","new_app_login_successes_14d","new_app_login_success_rate","synthetic_login_attempts_14d","synthetic_login_successes_14d","synthetic_login_success_rate","auth_incidents_p0_p1_14d","auth_support_rate_7d","unresolved_high_severity_auth_tickets","evidence_sha256","all_thresholds_pass"],"properties":{"eligibility_window_days":{"const":365},"eligible_accounts":{"type":["integer","null"],"minimum":0},"migrated_accounts":{"type":["integer","null"],"minimum":0},"unresolved_identity_conflicts":{"type":["integer","null"],"minimum":0},"successful_old_app_accounts_14d":{"type":["integer","null"],"minimum":0},"new_app_login_attempts_14d":{"type":["integer","null"],"minimum":0},"new_app_login_successes_14d":{"type":["integer","null"],"minimum":0},"new_app_login_success_rate":{"type":["number","null"],"minimum":0,"maximum":1},"auth_incidents_p0_p1_14d":{"type":["integer","null"],"minimum":0},"auth_support_rate_7d":{"type":["number","null"],"minimum":0,"maximum":1},"all_thresholds_pass":{"type":"boolean"},"eligibility_definition_version":{"const":"OPS-08-paid-current-or-365d-activity-v1"},"measurement_window_start":{"type":["string","null"],"format":"date-time"},"measurement_window_end":{"type":["string","null"],"format":"date-time"},"measured_continuous_days":{"type":["integer","null"],"minimum":0},"synthetic_login_attempts_14d":{"type":["integer","null"],"minimum":0},"synthetic_login_successes_14d":{"type":["integer","null"],"minimum":0},"synthetic_login_success_rate":{"type":["number","null"],"minimum":0,"maximum":1},"unresolved_high_severity_auth_tickets":{"type":["integer","null"],"minimum":0},"evidence_sha256":{"type":["string","null"],"pattern":"^[0-9a-f]{64}$"}}},"email":{"type":"object","additionalProperties":false,"required":["mailbox","mailbox_verified","mx_provider","spf","dkim","dmarc","return_path","sender","reply_to","tls","canary","production_send_enabled"],"properties":{"mailbox":{"const":"info@onetimeonetime.com"},"mailbox_verified":{"type":"boolean"},"mx_provider":{"type":["string","null"]},"spf":{"$ref":"#/$defs/emailControl"},"dkim":{"$ref":"#/$defs/emailControl"},"dmarc":{"$ref":"#/$defs/emailControl"},"return_path":{"$ref":"#/$defs/emailControl"},"sender":{"type":"object","additionalProperties":false,"required":["address","config_source","verified"],"properties":{"address":{"const":"info@onetimeonetime.com"},"config_source":{"const":"protected_environment"},"verified":{"type":"boolean"}}},"reply_to":{"type":"object","additionalProperties":false,"required":["address","config_source","verified"],"properties":{"address":{"const":"info@onetimeonetime.com"},"config_source":{"const":"protected_environment"},"verified":{"type":"boolean"}}},"tls":{"$ref":"#/$defs/emailControl"},"canary":{"type":"object","additionalProperties":false,"required":["messages_sent","authentication_pass_rate","hard_bounce_rate","complaint_rate","all_links_pass"],"properties":{"messages_sent":{"type":"integer","minimum":0},"authentication_pass_rate":{"type":["number","null"],"minimum":0,"maximum":1},"hard_bounce_rate":{"type":["number","null"],"minimum":0,"maximum":1},"complaint_rate":{"type":["number","null"],"minimum":0,"maximum":1},"all_links_pass":{"type":"boolean"}}},"production_send_enabled":{"const":false}}},"callbacks":{"type":"array","minItems":1,"items":{"type":"object","additionalProperties":false,"required":["callback_id","provider","mode","purpose","method","path","current_origin","candidate_origin","current_registration_state","candidate_registration_state","redirect_allowed","raw_body_required","signature_verification","idempotency","dual_registration_supported","canary_result","secret_material_stored"],"properties":{"callback_id":{"type":"string","pattern":"^OPS-08-[A-Z0-9_-]+$"},"provider":{"enum":["stripe","zoom","vimeo","email_provider","support","application","other"]},"mode":{"enum":["test","sandbox","production","internal"]},"purpose":{"type":"string","minLength":5},"method":{"enum":["GET","POST"]},"path":{"type":"string","pattern":"^/"},"current_origin":{"type":["string","null"],"format":"uri"},"candidate_origin":{"type":["string","null"],"format":"uri"},"current_registration_state":{"enum":["active","inactive","not_observed","not_applicable"]},"candidate_registration_state":{"enum":["active","inactive","not_observed","not_applicable"]},"redirect_allowed":{"type":"boolean"},"raw_body_required":{"type":"boolean"},"signature_verification":{"enum":["pass","fail","not_run","not_applicable"]},"idempotency":{"enum":["pass","fail","not_run","not_applicable"]},"dual_registration_supported":{"enum":["yes","no","unknown"]},"canary_result":{"enum":["pass","fail","not_run","not_applicable"]},"secret_material_stored":{"const":false}}}},"monitoring":{"type":"object","additionalProperties":false,"required":["external_probe_interval_seconds","regions","http_5xx_rate_15m","login_success_rate_5m","signup_persistence_failure_rate_5m","callback_success_rate_5m","tls_errors","dns_resolver_agreement","monitor_assigned"],"properties":{"external_probe_interval_seconds":{"enum":[60,null]},"regions":{"type":["integer","null"],"minimum":3},"http_5xx_rate_15m":{"type":["number","null"],"minimum":0,"maximum":1},"login_success_rate_5m":{"type":["number","null"],"minimum":0,"maximum":1},"signup_persistence_failure_rate_5m":{"type":["number","null"],"minimum":0,"maximum":1},"callback_success_rate_5m":{"type":["number","null"],"minimum":0,"maximum":1},"tls_errors":{"type":["integer","null"],"minimum":0},"dns_resolver_agreement":{"type":["boolean","null"]},"monitor_assigned":{"type":"boolean"}}},"rollback":{"type":"object","additionalProperties":false,"required":["previous_source_sha","previous_service_id_sha256","private_dns_snapshot_sha256","previous_callback_snapshot_sha256","old_service_warm_until","rollback_owner_assigned","drill_passed","restore_probe_passed"],"properties":{"previous_source_sha":{"type":["string","null"],"pattern":"^[0-9a-f]{40}$"},"previous_service_id_sha256":{"type":["string","null"],"pattern":"^[0-9a-f]{64}$"},"private_dns_snapshot_sha256":{"type":["string","null"],"pattern":"^[0-9a-f]{64}$"},"previous_callback_snapshot_sha256":{"type":["string","null"],"pattern":"^[0-9a-f]{64}$"},"old_service_warm_until":{"type":["string","null"],"format":"date-time"},"rollback_owner_assigned":{"type":"boolean"},"drill_passed":{"type":"boolean"},"restore_probe_passed":{"type":"boolean"}}},"mutation_audit":{"type":"object","additionalProperties":false,"required":["root_dns_changed","launch_dns_changed","production_deployed","provider_registration_changed","email_dns_changed","production_send_enabled","mutation_count"],"properties":{"root_dns_changed":{"type":"boolean"},"launch_dns_changed":{"type":"boolean"},"production_deployed":{"type":"boolean"},"provider_registration_changed":{"type":"boolean"},"email_dns_changed":{"type":"boolean"},"production_send_enabled":{"const":false},"mutation_count":{"type":"integer","minimum":0}}}},"$defs":{"emailControl":{"type":"object","additionalProperties":false,"required":["state","evidence_sha256","pass"],"properties":{"state":{"enum":["observed","not_observed","not_applicable"]},"evidence_sha256":{"type":["string","null"],"pattern":"^[0-9a-f]{64}$"},"pass":{"type":"boolean"}}}}}
