{
  "callbacks": [
    {
      "callback_id": "OPS-08-STRIPE-TEST-WEBHOOK",
      "canary_result": "not_run",
      "candidate_origin": null,
      "candidate_registration_state": "not_observed",
      "current_origin": null,
      "current_registration_state": "not_observed",
      "dual_registration_supported": "unknown",
      "idempotency": "not_run",
      "method": "POST",
      "mode": "test",
      "path": "/api/v1/billing/webhooks/provider",
      "provider": "stripe",
      "purpose": "Stripe TEST billing webhook seam",
      "raw_body_required": true,
      "redirect_allowed": false,
      "secret_material_stored": false,
      "signature_verification": "not_run"
    },
    {
      "callback_id": "OPS-08-ZOOM-OAUTH",
      "canary_result": "not_run",
      "candidate_origin": null,
      "candidate_registration_state": "not_observed",
      "current_origin": null,
      "current_registration_state": "not_observed",
      "dual_registration_supported": "unknown",
      "idempotency": "not_run",
      "method": "GET",
      "mode": "sandbox",
      "path": "/api/v1/providers/zoom/oauth/callback",
      "provider": "zoom",
      "purpose": "Zoom OAuth redirect and launch seam",
      "raw_body_required": false,
      "redirect_allowed": false,
      "secret_material_stored": false,
      "signature_verification": "not_applicable"
    },
    {
      "callback_id": "OPS-08-VIMEO-WEBHOOK",
      "canary_result": "not_run",
      "candidate_origin": null,
      "candidate_registration_state": "not_observed",
      "current_origin": null,
      "current_registration_state": "not_observed",
      "dual_registration_supported": "unknown",
      "idempotency": "not_run",
      "method": "POST",
      "mode": "sandbox",
      "path": "/api/v1/providers/vimeo/webhook",
      "provider": "vimeo",
      "purpose": "Vimeo callback/event seam",
      "raw_body_required": true,
      "redirect_allowed": false,
      "secret_material_stored": false,
      "signature_verification": "not_run"
    },
    {
      "callback_id": "OPS-08-EMAIL-PROVIDER-WEBHOOK",
      "canary_result": "not_run",
      "candidate_origin": null,
      "candidate_registration_state": "not_observed",
      "current_origin": null,
      "current_registration_state": "not_observed",
      "dual_registration_supported": "unknown",
      "idempotency": "not_run",
      "method": "POST",
      "mode": "production",
      "path": "/api/v1/delivery/provider-events",
      "provider": "email_provider",
      "purpose": "Bounce complaint and delivery callback seam",
      "raw_body_required": true,
      "redirect_allowed": false,
      "secret_material_stored": false,
      "signature_verification": "not_run"
    },
    {
      "callback_id": "OPS-08-SUPPORT-EVENT",
      "canary_result": "not_run",
      "candidate_origin": null,
      "candidate_registration_state": "not_observed",
      "current_origin": null,
      "current_registration_state": "not_observed",
      "dual_registration_supported": "unknown",
      "idempotency": "not_run",
      "method": "POST",
      "mode": "internal",
      "path": "/api/v1/support/events",
      "provider": "support",
      "purpose": "Support event intake seam",
      "raw_body_required": false,
      "redirect_allowed": false,
      "secret_material_stored": false,
      "signature_verification": "not_run"
    }
  ],
  "captured_at": "2026-07-16T05:44:27.867Z",
  "domains": [
    {
      "canonical_behavior": "unknown",
      "dns_records": [
        {
          "captured_at": "2026-07-16T05:34:13.775Z",
          "owner": "onetimeonetime.com",
          "private_change_set_member": false,
          "resolver_agreement": true,
          "resolver_count": 3,
          "ttl": 600,
          "type": "A",
          "value_sha256": "8617b972451ec276ea186ddebcd7a689c407bcc0278715c4b04dfa3914555bbf"
        },
        {
          "captured_at": "2026-07-16T05:34:13.775Z",
          "owner": "onetimeonetime.com",
          "private_change_set_member": false,
          "resolver_agreement": true,
          "resolver_count": 3,
          "ttl": 3600,
          "type": "MX",
          "value_sha256": "bdf143d06ef1c2c037b384f13ceea2dccb4c9d7b489041fbd5f2abc181af165c"
        },
        {
          "captured_at": "2026-07-16T05:34:13.775Z",
          "owner": "onetimeonetime.com",
          "private_change_set_member": false,
          "resolver_agreement": true,
          "resolver_count": 3,
          "ttl": 3600,
          "type": "MX",
          "value_sha256": "f7d0edfce66ff9bce2c70975909a056d275dbe5f53fb40d30d0eeba968187da1"
        },
        {
          "captured_at": "2026-07-16T05:34:13.775Z",
          "owner": "onetimeonetime.com",
          "private_change_set_member": false,
          "resolver_agreement": true,
          "resolver_count": 3,
          "ttl": 3600,
          "type": "MX",
          "value_sha256": "c0937693e0f493915704a9418d4a99ab2881f95dc979302eb8b292df038fd31d"
        },
        {
          "captured_at": "2026-07-16T05:34:13.775Z",
          "owner": "onetimeonetime.com",
          "private_change_set_member": false,
          "resolver_agreement": true,
          "resolver_count": 3,
          "ttl": 1800,
          "type": "TXT",
          "value_sha256": "127ad32c57f22ea0a9c25c0a041708edf1d3c5d6fd7d64f06f2ebd9b95dc4c19"
        },
        {
          "captured_at": "2026-07-16T05:34:13.775Z",
          "owner": "onetimeonetime.com",
          "private_change_set_member": false,
          "resolver_agreement": true,
          "resolver_count": 3,
          "ttl": 1800,
          "type": "TXT",
          "value_sha256": "7d07eab82a3a01b54c8505a45e85ae073856e3a19ee076a0ffc7b8bcc11c0c3c"
        },
        {
          "captured_at": "2026-07-16T05:34:13.775Z",
          "owner": "onetimeonetime.com",
          "private_change_set_member": false,
          "resolver_agreement": true,
          "resolver_count": 3,
          "ttl": 1800,
          "type": "TXT",
          "value_sha256": "9132ca20e3a22eca566ce1c0b29b4704eca56ac7cc88e00b2fb8276bc6a1fbe2"
        },
        {
          "captured_at": "2026-07-16T05:34:13.775Z",
          "owner": "onetimeonetime.com",
          "private_change_set_member": false,
          "resolver_agreement": true,
          "resolver_count": 3,
          "ttl": 3600,
          "type": "NS",
          "value_sha256": "8fdaaf7aa4d67cd3be24a9e12325fde9d5cb880a29c1cb4d7f367adf36705918"
        },
        {
          "captured_at": "2026-07-16T05:34:13.775Z",
          "owner": "onetimeonetime.com",
          "private_change_set_member": false,
          "resolver_agreement": true,
          "resolver_count": 3,
          "ttl": 3600,
          "type": "NS",
          "value_sha256": "e12fce9c6017d87edd60b3e5bf50f90e72af55a9bdae66a700f21dd0e7de5c29"
        }
      ],
      "evidence_state": "observed",
      "hostname": "onetimeonetime.com",
      "http_status": 200,
      "role": "root",
      "root_mutation_permitted": false,
      "tls": {
        "chain_valid": true,
        "issuer": "YE1",
        "not_after": "2026-09-11T02:12:27.000Z",
        "san_match": true,
        "state": "valid"
      }
    },
    {
      "canonical_behavior": "unknown",
      "dns_records": [],
      "evidence_state": "partially_observed",
      "hostname": "www.onetimeonetime.com",
      "http_status": null,
      "role": "www",
      "root_mutation_permitted": false,
      "tls": {
        "chain_valid": false,
        "issuer": null,
        "not_after": null,
        "san_match": false,
        "state": "invalid"
      }
    },
    {
      "canonical_behavior": "serves_primary",
      "dns_records": [
        {
          "captured_at": "2026-07-16T05:34:09.848Z",
          "owner": "join.onetimeonetime.com",
          "private_change_set_member": false,
          "resolver_agreement": false,
          "resolver_count": 3,
          "ttl": 3600,
          "type": "A",
          "value_sha256": "5341b4def440ffbdde7f6bd82e2857a1c72bc28b053b0d3f999ec5d059a5c843"
        },
        {
          "captured_at": "2026-07-16T05:34:09.848Z",
          "owner": "awaz36ln.up.railway.app",
          "private_change_set_member": false,
          "resolver_agreement": false,
          "resolver_count": 3,
          "ttl": 60,
          "type": "A",
          "value_sha256": "f939c8a229a08becbfcf2e64098ea8d246278a0d5f195feac339c5272010812d"
        },
        {
          "captured_at": "2026-07-16T05:34:09.848Z",
          "owner": "join.onetimeonetime.com",
          "private_change_set_member": false,
          "resolver_agreement": false,
          "resolver_count": 3,
          "ttl": 60,
          "type": "A",
          "value_sha256": "f939c8a229a08becbfcf2e64098ea8d246278a0d5f195feac339c5272010812d"
        },
        {
          "captured_at": "2026-07-16T05:34:09.848Z",
          "owner": "join.onetimeonetime.com",
          "private_change_set_member": false,
          "resolver_agreement": false,
          "resolver_count": 3,
          "ttl": 3600,
          "type": "AAAA",
          "value_sha256": "5341b4def440ffbdde7f6bd82e2857a1c72bc28b053b0d3f999ec5d059a5c843"
        },
        {
          "captured_at": "2026-07-16T05:34:09.848Z",
          "owner": "join.onetimeonetime.com",
          "private_change_set_member": false,
          "resolver_agreement": true,
          "resolver_count": 3,
          "ttl": 3600,
          "type": "CNAME",
          "value_sha256": "5341b4def440ffbdde7f6bd82e2857a1c72bc28b053b0d3f999ec5d059a5c843"
        },
        {
          "captured_at": "2026-07-16T05:34:09.848Z",
          "owner": "join.onetimeonetime.com",
          "private_change_set_member": false,
          "resolver_agreement": false,
          "resolver_count": 3,
          "ttl": 3600,
          "type": "MX",
          "value_sha256": "5341b4def440ffbdde7f6bd82e2857a1c72bc28b053b0d3f999ec5d059a5c843"
        },
        {